{
  "directoryStructure": "utils/\n‚îú‚îÄ‚îÄ command.ts\n‚îú‚îÄ‚îÄ input.ts\n‚îú‚îÄ‚îÄ output.ts\n‚îú‚îÄ‚îÄ streaming-json.test.ts\n‚îú‚îÄ‚îÄ streaming-json.ts\n‚îú‚îÄ‚îÄ ui.test.ts\n‚îî‚îÄ‚îÄ ui.ts\nREADME.md",
  "files": {
    "command.ts": "\nimport type {\nimport { printError, printOutput } from './output.js';\n\nexport interface CommandDefinition {\n\nexport abstract class Command {\n\n\n\n\n\n\n\n\n\n\n\nexport class CommandRegistry {\n\n\n\n\n\n\nexport const registry = new CommandRegistry();\n\nexport async function registerBuiltinCommands(): Promise<void> {\n\n/* ... implementation details stripped ... */",
    "input.ts": "\nexport function isStdinPiped(): boolean {\n\nexport function readFromInput(): Promise<string> {\n\n\n\n\n\n\nexport function readStdinSync(): string {\n\n\n/* ... implementation details stripped ... */",
    "output.ts": "\nimport type { CLIOptions } from '../types/index.js';\n\n\nexport function formatOutput(\n\n\n\n\nexport function printOutput(\n\nexport function printError(message: string, options: CLIOptions = {}): void {\n\nexport function printSuccess(message: string, options: CLIOptions = {}): void {\n\nexport function printWarning(message: string, options: CLIOptions = {}): void {\n\nexport function printInfo(message: string, options: CLIOptions = {}): void {\n\nexport function printTable(\n\n\n\n\n\nexport function printProgress(\n\nexport function printHeader(options: CLIOptions = {}): void {\n\n\nexport function exit(code: number): never {\n/* ... implementation details stripped ... */",
    "streaming-json.test.ts": "\nimport { describe, it, expect } from 'vitest';\nimport {\nimport type { ProjectSnapshot } from '../types/index.js';\n\n    'src/main.ts': 'export function main() {}',\n    'src/utils.ts': 'export function util() {}'\n\n\n\n\n\n\n\n\n\n\n\n\n\n\n\n\n\n\n\n\n\n\n\n\n\n\n\n/* ... implementation details stripped ... */",
    "streaming-json.ts": "\nimport { createReadStream, statSync } from 'fs';\nimport { readFromInput } from './input.js';\nimport type { ProjectSnapshot, SnapshotMetadata } from '../types/index.js';\n\n\nexport async function parseJSON(input: string): Promise<ProjectSnapshot> {\n\n\n\nfunction parseJSONStreaming(input: string): ProjectSnapshot {\n\n\nexport async function loadSnapshotFromFile(filePath: string): Promise<ProjectSnapshot> {\n\n\n\nasync function loadSnapshotStreaming(filePath: string): Promise<ProjectSnapshot> {\n\n\n\n\n\n\nexport async function loadSnapshot(input?: string): Promise<ProjectSnapshot> {\n\n\n\n\nexport function calculateMetadata(snapshot: ProjectSnapshot): SnapshotMetadata {\n\n\n\nexport function validateSnapshot(snapshot: unknown): snapshot is ProjectSnapshot {\n\n\n\nexport function getFilePaths(snapshot: ProjectSnapshot, prefix?: string): string[] {\n\n\n\nexport function extractFiles(\n\n\n/* ... implementation details stripped ... */",
    "ui.test.ts": "\nimport { describe, it, expect } from 'vitest';\nimport { parseDirectoryStructure, getAllFilePaths, findNodeByPath } from './ui.js';\n\n\n\n\n\n\n\n\n\n\n\n\n\n\n\n\n\n\n\n\n\n\n\n\n\n\n\n\n\n\n\n\n\n\n\n\n\n\n/* ... implementation details stripped ... */",
    "ui.ts": "\nexport interface TreeNode {\n\nexport function parseDirectoryStructure(structure: string): TreeNode {\n\n\n\n\n\n\n\n\n\nfunction parseTreeLine(\n\n\n\n\nexport function getAllFilePaths(node: TreeNode): string[] {\n\n  function traverse(current: TreeNode) {\n\n\n\nexport function findNodeByPath(root: TreeNode, path: string): TreeNode | null {\n\n\n/* ... implementation details stripped ... */",
    "README.md": "# Utils\\nThis snapshot contains utility functions.\n"
  },
  "instruction": "New global instruction",
  "fileSummary": "Summarized architectural map of 8 files."
}
