{
  "directoryStructure": "project/\nв”њв”Ђв”Ђ src/\nв”‚   в”њв”Ђв”Ђ main.ts\nв”‚   в”њв”Ђв”Ђ utils/\nв”‚   в”‚   в””в”Ђв”Ђ helpers.ts\nв”‚   в””в”Ђв”Ђ components/\nв”‚       в””в”Ђв”Ђ App.tsx\nв”њв”Ђв”Ђ package.json\nв”њв”Ђв”Ђ README.md\nв””в”Ђв”Ђ tsconfig.json",
  "files": {
    "src/main.ts": "export async function main() {\n  console.log('Hello, World!');\n  await init();\n}\n\nasync function init() {\n  // TODO: Implement initialization\n  const result = await fetchData();\n  return result;\n}",
    "src/utils/helpers.ts": "export function formatDate(date: Date): string {\n  return date.toISOString().split('T')[0];\n}\n\nexport function capitalize(str: string): string {\n  return str.charAt(0).toUpperCase() + str.slice(1);\n}",
    "src/components/App.tsx": "import React from 'react';\n\ninterface Props {\n  title: string;\n}\n\nexport function App({ title }: Props) {\n  return (\n    <div className=\"app\">\n      <h1>{title}</h1>\n    </div>\n  );\n}",
    "package.json": "{\n  \"name\": \"test-project\",\n  \"version\": \"1.0.0\"\n}",
    "README.md": "# Test Project\n\nThis is a test project for jref CLI.",
    "tsconfig.json": "{\n  \"compilerOptions\": {\n    \"target\": \"ES2020\",\n    \"module\": \"ESNext\"\n  }\n}"
  },
  "instruction": "This is a test snapshot for the jref CLI tool.",
  "fileSummary": "Contains TypeScript source files and configuration.",
  "userProvidedHeader": "JREF TEST SNAPSHOT v1.0"
}